PID,title,body,pcreated,serial,signature_count,signatures_needed,signature_threshold,status
4e7b352b4bd5046c04000000,"Stop Animal Homelessness at Its Roots","
Every year in the United States, an estimated 6 to 8 million lost, abandoned, or unwanted dogs and cats enter animal shelters and nearly half of these animals—many of them healthy, young, and adoptable—must be euthanized because there are too many animals and not enough good homes. 

This tragedy occurs because people don't spay and neuter their animals and because greedy breeders continue to churn out more puppies. Because all dogs and cats are precious and because no more animals need to be bred when so many others go without hope of being adopted, PETA is calling for a mandatory spay-and-neuter law until all dogs and cats in the United States have a home to call their own. 

Sign the petition calling for a mandatory spay-and-neuter law to help end the animal overpopulation crisis. 
","2011-09-22 09:18:43",1,11786,0,5000,Reviewed
4e7b35898d8c37d975000000,"Grant voters the ability to vote for the President of the United States by dissolving the electoral college.","The elections of 1824, 1876, 1888, and 2000 produced an Electoral College winner who did not receive the plurality of the nationwide popular vote - that is, the American people did not get the President democracy should have selected.

Due to the way electoral votes are allocated, candidates have a strong incentive to focus their campaigns on "swing" states with many voters, such as Florida, and neglect states such as Texas which do not swing.   Due to necessary rounding errors when allocating votes, members of a sparsely populated state effectively accrue more voting power than members of a well-populated state.  This increases the electoral power of members of certain states while reducing it for others on an ongoing basis.

We beg our leaders to dissolve this system and let us vote.","2011-09-22 09:30:13",6,29311,0,5000,Reviewed
4e7b3623709f036e7a000002,"Reject the Keystone XL Pipeline","The proposed Keystone XL pipeline threatens our water, our land, and our future. If permitted and constructed, the pipeline would further fuel the devastating extraction of tar sands in Alberta, and funnel highly toxic tar sands oil across the U.S.

Big Oil has exploited the Canadian tar sands to great profit, but the environment and indigenous communities have paid a steep price.

The threat that pipeline spills pose to our land and water supplies is simply unacceptable. 

Additionally, tar sands oil produces three times as much carbon pollution as conventional oil. We have a moral obligation to prevent the expansion of the tar sands and move towards a 100% clean energy future.

Please reject the Keystone XL permit and invest in real solutions to our climate and energy crisis.","2011-09-22 09:24:18",11,7875,0,5000,Reviewed
4e7b37f611fb9c1179000000,"eliminate the permanent division of retention/retirement pay of members of the Uniformed Services in a divorce","The permanent division of retention/retirement pay of members of the Uniformed Services in a divorce as property under the authority of 10 U.S.C. 1408, the Uniformed Services Former Spouses Protection Act, PL 97-252, is inconsistent with prevalent family law concepts, unfairly singles out personnel of the uniformed services for unequal treatment of a divorce, is discriminatory on its face and in impact, is inconsistent with other federal laws, violates the constitutional concepts of federalism, and unconstitutionally interferes with Presidential and Congressional duties to provide for the Armed Forces. Such action by the President and Congress will reestablish the proper legal precedent as established by the U.S. Supreme Court in McCarty v. McCarty, 453 US 210 (1981).","2011-09-22 09:33:58",16,2542,2458,5000,Closed
4e7b3978b25636027d000000,"Fund National Institutes of Health clinical trial of Low Dose Naltrexone as Multiple Sclerosis generic drug treatment.","Low Dose Naltrexone (LDN) may be the most effective drug available today at preventing the disability caused by Multiple Sclerosis, yet most doctors do not know about LDN because it has not been approved by the FDA for Multiple Sclerosis. 

Unfortunately, because generic Naltrexone has been without patent protection for many years, no pharmaceutical company will bear the expense of the clinical trials necessary for FDA approval of LDN’s new special uses. It is now up to public institutions to seize the opportunity that LDN offers.

For more information visit:  www.LDNaware.org","2011-09-22 11:12:07",21,754,4246,5000,Closed
4e7b3ea34bd504e006000002,"Change US policy to confront the government of Sudan for ongoing mass atrocities and act to protect innocent civilians","Recent events in Southern Kordofan, Blue Nile, Abyei and Darfur prove that the government of Sudan is continuing to use the same deadly methods that it has employed for years against its own people: attacking civilians on a broad scale with its army, militia and air force; limiting and blocking humanitarian assistance to millions displaced by attacks; and focusing US attention on negotiations that are not honored. It is time for significantly escalated action by the United States consistent with the Responsibility to Protect doctrine. Condemnations of new war crimes, crimes against humanity and genocide are necessary, but not sufficient. 

8 years after the start of the Darfur genocide, it is time for escalated action by the US to stop the genocides and mass atrocities in Sudan.","2011-09-22 10:45:37",26,608,4392,5000,Closed
4e7b3ea711fb9c3d7a000004,"Fully Legalize Same-Sex Marriage Across The Nation","Only 6 states, Connecticut, Iowa, Massachusetts, New Hampshire, New York and Vermont, plus the District of Columbia, currently legally allow same-sex couples to get married and have the same benefits as heterosexual couples.  And also, though these 6 states, plus D.C., allow same-sex marriage, federally, they are not recognized at all, whatsoever.  The LGBT community is the last group of people to not get  full rights in our nation, the great nation of freedom and opportunity.  We the people need to call on President Barack Obama to take a stand as our country's leader, and fully legalize same-sex marriage across the whole nation.","2011-09-22 10:12:57",31,17303,0,5000,Reviewed
4e7b3f188d8c37d875000004,"Legalize and Regulate Marijuana in a Manner Similar to Alcohol.","We the people want to know when we can have our "perfectly legitimate" discussion on marijuana legalization. Marijuana prohibition has resulted in the arrest of over 20 million Americans since 1965, countless lives ruined and hundreds of billions of tax dollars squandered and yet this policy has still failed to achieve its stated goals of lowering use rates, limiting the drug's access, and creating safer communities.

Isn't it time to legalize and regulate marijuana in a manner similar to alcohol? If not, please explain why you feel that the continued criminalization of cannabis will achieve the results in the future that it has never achieved in the past? ","2011-09-22 10:03:04",36,75057,0,5000,Reviewed
4e7b416e8d8c37da75000004,"Legalize, regulate, and tax marijuana.","There is an overwhelming lack of evidence that marijuana is a dangerous drug that should be classified with heroin or cocaine. Hundreds of thousands of otherwise peaceful, law abiding citizens are arrested each year for simple possession, at enormous cost to our society. Our prisons are too crowded, we need the money, and the regulated sale of marijuana would be safer for everybody. Americans would rather deal with shopkeepers than drug dealers when buying the marijuana they will consume regardless of its legal status. Prohibition failed in the '20s, and is failing us now.","2011-09-22 10:18:43",41,20104,0,5000,Reviewed
4e7b421dcf436a2374000007,"EXTEND THE INVESTMENT TAX CREDIT GRANT (SECTION 1603) PROGRAM","The 1603 Treasury Program allows owners of property, like biogas producing digesters, that would otherwise qualify for Internal Revenue Code Section 45 (production tax credit) or 48 (investment tax credit) to receive a cash grant from the U.S. Treasury in lieu of the credit and in the amount of a 30% investment tax credit. Within 1603 requirements, the "commence construction" deadline to qualify for these grants is approaching (12/31/11). We, The People, petition the Administration deadline (as well as the placed in service date) to 1/1/14, or better yet, eliminate the "sunset provision" altogether.  The 1603 Program creates jobs, stimulates private investment, contributes to a cleaner environment and enhances national security by producing renewable energy in the U.S.","2011-09-22 10:22:45",46,440,4560,5000,Closed
4e7b4cb911fb9cf478000005,"ban the sale, trade, and possession of shark and shark products, including shark fin.","One third of all shark species are threatened or near threatened with extinction.To reverse this trend, the USA must be a leader in protecting these important predators.The Administration has championed international agreements and signed the Shark Conservation Act, but this only mandates how a shark is killed, not how many.  On average, the USA lands 30,000 tons of shark per year. Palau, Maldives, Honduras, Bahamas, and Tokelau have declared national shark sanctuaries, banning the commercial fishing of sharks in their waters and ending the shark trade. Domestically, laws have been passed banning the sale, trade, and possession of shark in Hawaii, Washington, Oregon, California, and the territories of Guam and Northern Marianas.  The USA should implement a national shark and shark fin ban.","2011-09-22 10:57:25",51,6497,0,5000,Reviewed
4e7b4d56cf436ad904000003,"grant clemency to Native American activist Leonard Peltier without delay.","10th Circuit Court of Appeals: "…Much of the government’s behavior... and its prosecution of Leonard Peltier is to be condemned. The government withheld evidence. It intimidated witnesses. These facts are not disputed."  

While others were acquitted on grounds of self defense, Peltier was convicted in connection with the 1975 shooting deaths of two FBI agents.  Evidence shows that prosecutors knowingly presented false statements to a Canadian court to extradite Peltier and manufactured the murder weapon (the gun and shell casings entered into evidence didn't match; this fact was hidden from the jury). The number of constitutional violations in this case is simply staggering.

It's time to right this wrong. Mr. President, you can and must free Leonard Peltier.","2011-09-22 11:49:20",56,5633,0,5000,Reviewed
4e7b4d642ee8d0a005000001,"Call an Investigation into Allegations of Prosecutorial & Judicial Misconduct in the Case of Sholom Rubashkin","Dear President Obama,

We, your undersigned Americans, knowing you to be committed to fairness and justice, hereby Petition that you direct your Attorney General:

(1) To take prompt and effective steps to correct the gross injustice that has been perpetrated with the federal prosecution of Sholom Rubashkin.

(2) To initiate an investigation into this case as has been requested by 47 Members of the House of Representatives, who have separately and independently written to Attorney General Eric Holder about the prosecution of Sholom Rubashkin.

(3) To respond to the demand made by 75 law professors and former U.S. Attorneys (including three former Deputy Attorneys General) to investigate prosecutorial misconduct in the case of United States vs. Sholom Rubashkin.

www.justiceforsholom.org","2011-09-22 11:00:33",61,52819,0,5000,Reviewed
4e7b4da8709f03747a000009,"Give Good Friday commemorative status in the USA.","The Good Friday National Holiday Campaign, Inc., seeks to establish Good Friday as a commemorative day in the United States of America. To date, it is a national holiday in over 135 countries, in the United States of America it is a State Holiday in 11 States, and 3 US Territories.

We the undersigned seek to enshrine Good Friday as a Federal holiday under Title V of the United States Code (5 U.S.C, § 6103) due to its long standing tradition in American culture and history.","2011-09-22 11:21:16",66,564,4436,5000,Closed
4e7b4e1a11fb9c3e7a000010,"Light The White House Blue on Men's Health Night, November 21, to raise Prostate and Testicular cancer awareness.","Prostate and Testicular Cancer affects the lives of millions of Americans.  Whether by diagnosis, treatment costs, lost work and family hours and, even death, prostate and testicular cancer cause pain throughout our nation, every minute of every day. 
Mr. President, please light the White House blue to honor the more than 340,000 American men who have died from prostate and testicular cancer in the past decade; for the more than 228,000 new cases that will be diagnosed this year; for African-American men who are 60 percent more likely to be diagnosed with prostate cancer and 2.4 times more likely to die from it and for the nearly 2.5 million American men and their families who are currently challenged by these cancers.","2011-09-22 11:30:20",71,670,4330,5000,Closed
4e7b5032ec309e6276000013,"INVESTIGATION FOR FULL DISCLOSURE OF WHERE AND WHEN AGENT ORANGE HERBICIDES WERE USED OUTSIDE OF VIETNAM TO INCLUDE GUAM","this petition is for a full investigation into all of the locations where agent orange herbicides were used and when they were used. Because of destroyed military records for routine base maintenance, any documentation was lost. Because of the importance of this issue affecting veterans and their families plus future generations of Americans, this petition should be given the highest priority within the Whitehouse staff. This petition can coincide with Senator Gillibrand's investigation into Agent Orange herbicide use and HR2634 VICTIMS OF AGENT ORANGE. ","2011-09-22 11:15:30",76,743,4257,5000,Closed
4e7b6372b25636f47800000f,"Repeal the Patriot Act","We, the undersigned, hereby declare that anti-terrorism legislation passed by our US Congress since the tragic September 11, 2001 attacks on our nation, seriously damage and infringe upon the constitutional protections that are enshrined in our Bill of Rights.

We declare that it is not patriotic, but rather Un-American to destroy the very freedoms which cause Americans to love their country. We oppose the “sneak and peek” provision of the PATRIOT Act, which infringes our 4th amendment protections against unreasonable search and seizure by denying citizens their right to be aware that their property is to be searched and their right to protest such search. We oppose the PATRIOT Act’s destruction of e-mail and Internet privacy. 

"Those who sacrifice liberty for security deserve neither"","2011-09-22 12:38:29",81,22718,0,5000,Reviewed
4e7b63768d8c376606000005,"Stop Interfering With State Marijuana Legalization Efforts","The “war on drugs” has yielded predictable suffering and waste, as the prohibition of widely desired substances has never generated positive results - except for the cartels and gangs who control the illegal market. Marijuana prohibition in particular is a colossal waste of resources that could be put to better use. Taking a noncriminal, regulatory approach to marijuana would enable states to pass their own laws, regulations and taxes to control marijuana and would end the Justice Department's intimidation tactics in medical marijuana states. One or more states will likely legalize adult use of marijuana in 2012, and the Obama administration should stop wasting scarce federal resources and uphold the president’s campaign pledge to respect states’ rights when it comes to marijuana.","2011-09-22 12:44:19",86,17054,0,5000,Reviewed
4e7b6695b25636dc79000011,"End the destructive, wasteful and counterproductive "War on Drugs"","In order to resolve a wealth of inequities, we the people do entreat the white house to dismantle or redirect law enforcement agencies, and the approximately $400 BILLION dollars per year spent on the "War on Drugs".

The U.S. represents 5% of world population, but imprisons 25% of all the worlds inmates.  It is not the U.S. people who are excessively criminal.  It is overzealous policy that destroys the future of America's youth at great expense to the taxpayer.

Where would you be, Mr. President, had you been convicted and imprisoned because of your admitted Marijuana usage?  What great future leaders, thinkers and innovators are being destroyed today because of this useless policy?

Drug use is a social issue, and should be addressed by health care professionals, not the prison system.","2011-09-22 16:54:05",91,30018,0,5000,Reviewed
4e7b6832ec309e607600000c,"Help Families Avoid Foreclosure, Stabilize the Housing Market, and Boost the Economy: Adopt the Principal Paydown Plan","Experts agree that in order for the economy to recover, the housing market first must be stabilized by preventing avoidable foreclosures.  While there is no single solution to the foreclosure crisis, one promising approach is the Principal Paydown Plan, which would provide immediate relief for qualified homeowners in bankruptcy who find themselves underwater on their mortgages. By reducing the interest rate on mortgages to 0% for 5 years, monthly payments would be lowered and every dollar applied to the principal.  This Plan would provide help for many American families trying to stay in their homes, stabilize communities, and bolster the housing market and economy as a whole.  Developed by the National Association of Consumer Bankruptcy Attorneys, the plan is ready for immediate adoption.","2011-09-22 17:21:39",96,3137,1863,5000,Closed
4e7b6fe58d8c37be12000004,"Extend unemployment benefits past 99 weeks for ALL long-term unemployed Americans - for the 99ers and ANY "exhaustee".","Very soon an estimated 10 million Americans and their families will have exhausted all 99 weeks of their unemployment insurance benefits (or whatever their State's maximum qualifying weeks were). Please extend these benefits past 99 weeks for ALL long-term unemployed Americans, especially for the “99ers” and any "exhaustee", until there are enough jobs available. Because of age or physical imitations, many can not be expected to pick up a shovel. Many have already been without any income at all for a year or longer and barely subsist on food stamps. The 99ers and “exhaustees” can no longer wait for 14 million jobs to gradually come online over a protracted period of time. We've waited as long as we could.
http://bud-meyers.blogspot.com/2011/09/official-white-house-petition-for-99ers.html ","2011-09-22 13:58:42",101,1866,3134,5000,Closed
4e7b70294bd5044b0c00000f,"formally acknowledge an extraterrestrial presence engaging the human race - Disclosure.","Disclosure Petition - Paradigm Research Group
"We, the undersigned, strongly urge the President of the United States to formally acknowledge an extraterrestrial presence engaging the human race and immediately release into the public domain all files from all agencies and military services relevant to this phenomenon."
___
Hundreds of military and government agency witnesses have come forward with testimony confirming this extraterrestrial presence.   Opinion polls now indicate more than 50% of the American people believe there is an extraterrestrial presence and more than 80% believe the government is not telling the truth about this phenomenon.  The people have a right to know. The people can handle the truth.
Relevant Websites: www.disclosurepetition.info,  www.paradigmresearchgroup.org","2011-09-22 13:57:54",106,12092,0,5000,Reviewed
4e7b706011fb9cce0b00000a,"Stop Supporting Dictator and State-Terrorist Meles Zenawi of Ethiopia.","Throughout the Arab Spring, the Obama adm. has taken the side of protesting innocent civilians.Yet, US foreign policy has turned a blind eye to one of the most brutal dictators in the world: Meles Zenawi. Through the use of state-terrorism,torture,rape, and murder against the peoples within Ethiopia (Oromo, Sidama, Amhara, Ogaden-Somalis, Annuak, and others), Zenawi has held a cruel grip to the rule of Ethiopia for over 20 years now. Recently,BBC revealed the reality of Zenawi’s regime by exposing the use of billions of dollars of aid as a “weapon of oppression”, torture, and massive human rights violations:http://news.bbc.co.uk/2/hi/programmes/newsnight/9556288.stm
Why are US tax dollars and foreign policy supporting one of the most unstable, terroristic regimes in the world? Please sign!","2011-09-22 13:40:58",111,2757,2243,5000,Closed
4e7b71fab256360b1800000c,"Eliminate or Reform Departments whose Officers are Required by Law to Lie to the American People.","In a time of astronomical deficits, departments that are required by law to LIE to the American public should be reformed or eliminated.

The director of the Office of National Drug Control Policy (ONDCP), aka "The Drug Czar," is one such position.

See Title VII Office of National Drug Control Policy Reauthorization Act of 1998: H11225 (http://www.whitehouse.gov/ondcp/reauthorization-act).  In summary, this act requires the Drug Czar to effectively lie to preserve current drug policy, regardless of science or proof of medical efficacy of a Schedule I substance.

For detailed information and analysis, use your favorite search engine, or check out the following organizations and sites:

Drug WarRant
LEAP
DPA
NORML
http://www.drugwarrant.com/articles/drug-czar-required/

Sincerest Thanks.","2011-09-22 14:18:56",116,1770,3230,5000,Closed
4e7b74204bd504ea0c000011,"Repeal any and all laws pertaining to the illegalization of the Cannabis plant and all of its uses.","  We the People of The United States of America,
being of sound mind and sharing a unified spirit of commonsense and a strive for the betterment of the decisions the leaders of our country make, set forth a petition to you, The Government of The United States of America, asking for a repeal of any and all laws regarding Cannabis in any form and/or any materials, tools, devices, or utensils needed in the use or production of said plant.
 We believe you are needlessly wasting billions of dollars incarcerating otherwise law abiding citizens for a crime in wich there is no victim, thereby placing them in harms way.
 We believe that the major crime and violence are a direct result of illegalization
 We believe it is scientifically proven less harmful than any drug approved by the FDA.","2011-09-22 14:01:22",121,6650,0,5000,Reviewed
4e7b7bd5cf436ae672000018,"PUBLICLY press Japan for the return of Abducted US Children and provide transparent dialogs with Japan on this issue","Hundreds, if not thousands, of US Citizen Children have been abducted to, or retained in, the country of Japan. 

Japan has never returned a single child, has no legal concept of "joint-custody", no enforcement of visitation, no requirement for rules of evidence on claims of DV.

The US Congress, in HR1326, has publicly condemned Japan and demanded the immediate return of this children.

However, the Executive Branch has only held back-room discussions.  Additionally, there are persuasive claims the DoS is significantly downplaying the number of actual cases.

There needs to be complete transparency into this process, and public condemnation of Japan.  These are our country's children.  We the people deserve to know if they are being traded for bases or other government goals.","2011-09-22 14:31:42",126,1614,3386,5000,Closed
4e7b817d4bd504e006000018,"Allow Industrial Hemp to be Grown in the U.S. Once Again","Lost opportunities for farmers and businesses have real consequences. With over $419 million in estimated U.S. retail sales, American companies making hemp products have no choice but to import their raw materials because American farmers continue to fear they will be prosecuted due to an outdated federal policy which confuses non-drug industrial hemp with drug varieties of Cannabis.

Sustainable hemp seed, fiber and oil are already used in nutritious food, textiles, body care and even auto-parts. Many American companies are using imported hemp in their products today.

We urge you to allow U.S. farmers to follow in the footsteps of George Washington, Thomas Jefferson and John Adams, all who were hemp farmers, and once again grow this sustainable and profitable non-drug crop.","2011-09-22 14:45:43",131,28888,0,5000,Reviewed
4e7b8c8bec309e5d76000023,"Restore humane horse slaughter to improve horse welfare, stop needless & wasteful suffering & create jobs.","The GAO report "HORSE WELFARE: Action Needed to Address Unintended Consequences from Cessation of Domestic Slaughter" documents the decline in horse welfare, & the economic demise of the horse industry due to inappropriate federal intervention that closed the humane & regulated horse slaughter plants in the U.S. As pointed out by the GAO, & as testified to by practically every horse industry & Ag organization in the Nation, appropriation riders & bills that seek to eliminate any possibility of humanely processing horses offer zero solutions & only exacerbate the suffering of horses, increase the number of needless & wasteful deaths, cause more abandonment, neglect, pain, & misery--they deprive families of livelihoods & the ability to raise their kids with the joy of horses in their lives.","2011-09-22 15:49:50",136,5531,0,5000,Reviewed
