PID,title,body,pcreated,serial,signature_count,signatures_needed,signature_threshold,status
4ea890f5cf436a38100000a6,"STOP ALL FORECLOSURES AND EVICTIONS; RECONSTRUCT MORTGAGE LOANS WITH HOMEOWNERS AT CURRENT MARKET VALUE AT 2% FOR 30 YRS","STOP ALL FORECLOSURES AND EVICTIONS; RECONSTRUCT MORTGAGE LOANS WITH HOMEOWNERS AT CURRENT MARKET VALUE AND 2% INTEREST FOR 30 YEARS. No credit issue strings attached. Certified appraisals are commissioned by FHA and paid for by homeowner, not to exceed $500 and comps within a 2 mi radius. Home appraised value will determine if 2nd mortgage may be stripped. Homeowners must substantiate household income to pay mortgage, taxes, insurance and normal expenses and agree to reconstruct the loan in lieu of lawsuits against lenders for their bad acts. No further mortgages may be added to property for 5 years. Upon grant of loan reconstruction homeowner may apply to recordation office to remove any documents that are fraudulent or may cloud title.","2011-10-26 19:22:45",1161,924,24076,25000,Closed
4ea8918f8d8c377663000020,"Support access to geographic information systems technology and training in local governments.","Geographic Information Systems technology is becoming a foundation technology for providing services effectively and efficiently in local government. It is ubiquitous in everyday life, even. if you use GPS or online maps, look at maps on election night, or ever dialed 911, you've been a GIS consumer. GIS is useful in every service that uses an address. GIS can help fuel economy for school buses, allow police study crime trends, let parents to check for nearby predators, and it lets you get directions from here to there. GIS can help analyze social trends. It's critical in economic development efforts, and land, infrastructure and transit planning.

Funding for implementing and expanding GIS technology and training would actually make government more efficient and provide jobs.","2011-10-26 19:16:30",1166,898,24102,25000,Closed
4ea8a1edcf436a2a160000b2,"Recognize the Syrian National Council.","As the Syrian regime continue in defiance of the free world and Syrian peaceful protesters when they all in one voice demanded Assad to stop violating its people's human rights and step down immediately.
 We call on the Obama administration to rally the free world and the UN to recognize the Syrian National Council as the only legitimate representative of the Syrian people,and take a strong action on the Assad's regime","2011-10-26 20:40:21",1171,7743,17257,25000,Closed
4ea8b1e5cf436aaa080000ab,"Strengthen our democracy by publicly financing all elections so that money cannot buy anyone a member of congress.","We the People have the right to expect the highest standards of civic duty from our members of congress and we must have confidence that our public representatives are acting solely in the public's interest. The American people's elections must be decided by the American people, not by special interest groups with bulging checkbooks. If you agree with these proposals then please add your name next to ours. In order to make sure we pass this important legislation, it's absolutely crucial that we continue building support. Please forward this message to your friends and family to join you as co-sponsors. Thanks again for co-sponsoring this petition to the President and for your commitment to keeping our federal elections just and our elected officials honorable.","2011-10-26 21:35:05",1176,2707,22293,25000,Closed
4ea9e411ec309e4577000011,"Stop sending tax money to the government of Mauritania until it ends slavery and persecution of its black populations.","The U.S. spends millions of dollars in the form of military co-operation and development assistance to aid a Mauritanian government that is determined to protect slavery and build an Arab only nation by progressively de-Africanizing the country.

The Mauritanian government has directed genocide operations against black Africans. Among the perpetrators are high ranking officials in the administration who lead lavish lifestyles with complete impunity. 

Now, the authorities have embarked on different projects that aim to deny blacks of their right to citizenship and expropriate their lands.

20% of the population lives in slavery. The authorities refuse to crack down on this practice and persecute anti-slavery activists.

This is a moral issue that concerns all Americans.","2011-10-27 20:59:06",1181,843,24157,25000,Closed
4ea9f75bec309e6c0400000a,"Time for Hollywood Studios to PAY Respects To The Navy SEAL Community","We have formulated a Petition calling upon Hollywood Executives & Studios to stop exploiting our US Military service members (specifically US Navy SEALs) for profits.  We are asking these Studios to give substantial monies made from Studio Revenue, Licensing, Film Net Profit, Theater Share Percentages, DVD sales & Marketing Resources.  We are calling upon Hollywood to donate 30%-40% of total revenue generated as a result of film production revolving around the Osama Bin Laden Operation Geronimo to the Navy SEAL Foundation. The Navy SEAL Foundation aims to support US Navy SEALs, their families & those fallen sailors. By signing this petition you support the US Navy SEALs & are petitioning Hollywood to give back monies to those who protect our Freedoms.   Submitted by SupporttheSEALs.org","2011-10-27 20:45:51",1186,214,24786,25000,Closed
4eaa255453b2cfb54b000011,"Ensure all school libraries are properly staffed, open, and available for children every day.","Any school receiving Federal funds should be required to have a credentialed School Librarian on staff full time with a library that contains a minimum of 18 books per student.  Failure to have a school library open to all students and/or failure to have a credentialed School Librarian to run that library should be punishable by a immediate withdrawal of all Federal monies.
 
Study after study has shown that well-stocked, well-funded, well-organized school libraries staffed by a "highly qualified" School Librarian, or other similarly qualified credentialed individual, improve student reading scores, test scores, and literacy rates. All children have the right to read and to have access to materials that will help them grow as learners and as people.  No Library = No Freedom to Learn","2011-10-28 00:36:39",1191,10331,14669,25000,Closed
4eab1d14b25636090300002b,"Direct the US Forest Service to move the devotional Jesus shrine from federal property atop Big Mountain (Montana).","The Administration should enforce the constitutional principle of separation between state and church, by directing the US Forest Service to remove the devotional Jesus shrine on federal property atop Big Mountain in Flathead National Forest. 

Federal land has been misappropriated for 56 years for the direct benefit of the Knights of Columbus men’s club and its sectarian religious symbol.

The special use permit records the purpose as "to provide a site for a religious shrine." Even though the “war memorial” rationale is a sham, it would be impermissible for the federal government to host a sectarian display. This excludes non-Christian veterans, including the many “atheists in foxholes” who have served our country with distinction and valor. The Jesus statue belongs on private property.","2011-10-28 17:32:22",1196,2312,22688,25000,Closed
4eab46082ee8d0490c000031,"Take petitions seriously.","If you are going to create a public petition system, then take the petitions seriously.

Dismissing the top petitions with canned responses invalidates the whole exercise.","2011-10-28 20:19:13",1201,4619,20381,25000,Closed
4eab4aae2ee8d0dd0c000025,"regulate tobacco and alcohol in a manner similar to marijuana.","According to scientists at the National Institutes of Health, tobacco and alcohol are both associated with addiction and numerous serious mental and physical health issues. 

Given the extreme number of fatalities yearly as a direct result of alcohol or tobacco usage (tobacco accounts for 90% of lung cancer cases in the US; alcohol results in over 22,000 deaths annually), as well as the Obama administration's approach to reducing the potential harm caused by marijuana, we the people believe the time has come to create and enforce anti-tobacco and anti-alcohol laws similar to those currently enforced relating to marijuana. ","2011-10-28 20:43:18",1206,2521,22479,25000,Closed
4eab4abefb75286550000033,"Regulate Tobacco and Alcohol in a manner similar to Marijuana and other currently illegal substances.","Alcohol is the direct result of ~ 75,000 deaths EACH year in the USA ALONE.  

Tobacco has been linked to the death of ~ 440,000 EACH year in the USA ALONE.

Marijuana has been the direct cause of ZERO deaths, but it is illegal and considered a schedule 1 drug by the government. 

Alcohol, and Tobacco are not recognized for their medicinal value. While marijuana, on the other hand, has proven medicinal value. 
So it seems that if the health of our citizens is the true concern in regards to the current marijuana legislation, then it only seems fair and appropriate that alcohol and tobacco be made illegal and classified as Schedule 1 drugs. ","2011-10-28 20:50:18",1211,2476,22524,25000,Closed
4eab4cd83d2d5bfd28000040,"Regulate cigarettes and alcohol in a similar manner to marijuana since they are more dangerous to your health.","  Since you stated in your response to the marijuana petition that your wont legalize cannabis because "It is associated with addiction" , "causes cognitive dissonance", and the most ignorant statement of all "marijuana use is a significant source for voluntary drug treatment admissions and visits to emergency rooms" We The People demand that you regulate drugs that do actually kill people daily in the same way as Cannabis. Alcohol and tobacco are infinitely more harmful than cannabis and should be recognized as so according to the white houses own logic.","2011-10-28 20:54:20",1216,3208,21792,25000,Closed
4eab4d5aec309edc59000083,"Respond to the marijuana legalization petition with an argument that doesn't also apply to alcohol.","Adapted from: https://wwws.whitehouse.gov/petitions#!/response/what-we-have-say-about-legalizing-marijuana

According to scientists everywhere, alcohol use is associated with addiction, liver disease, and cognitive impairment. We know from an array of treatment admission information and Federal data that boozing is a significant source for voluntary drug treatment admissions and visits to emergency rooms and morgues. Studies also reveal that Bud Light drinkability has almost tripled over the past 20 years, raising serious concerns about what this means for public health – especially among normal people who start drinking before their 20's. Simply put, alcohol is not a benign drug. But it's legal, so why isn't marijuana? ","2011-10-28 20:53:05",1221,5176,19824,25000,Closed
4eab4d9e8d8c375a0a000039,"Regulate alcohol and tobacco in the same manner as marijuana.","We the people wish to understand and have a serious conversation as to how these dangerous drugs are considered legal when their effects/risks can be far more dangerous than of marijuana.","2011-10-28 20:51:55",1226,7043,17957,25000,Closed
4eab61b0709f03d511000037,"Open for debate the full legalization, taxation, and regulation of Marijuana, and not simply deny the people that debate","According to the latest Gallup poll 50% of Americans support full legalization of marijuana and only 46% are against this. The response to the first round of petitions regarding legalization has been simply to say "no legalization".  In a democratic country when the majority feel this is a worthy issue to debate simply saying "No" is unacceptable.

The fact of the matter is that the prohibition of marijuana only creates and exacerbates issues related to consumption. We learned this lesson with alcohol and ended that prohibition, this resulted in a huge drop in organized crime organized around the illegal alcohol trade. As marijuana is a far safer substance than alcohol should make this an easy choice. While legalization would not solve all issues it would be a much better solution.","2011-10-28 22:31:02",1231,4892,20108,25000,Closed
4eab69349cd1c14718000023,"Publicly Request the Resignation of Gil Kerlikowske.","Having refused to sincerely address the public's demand for marijuana legalization;

Having attempted to confuse the issue with biased and irrelevant statistics;

Having summarily rejected that domestic and international crime could decrease, and quality of life thereby increase;

Having summarily rejected the association between drug use and beneficial social change, as was seen during Vietnam Era protests;

Having engaged in propaganda to prevent drug use, rather than promote educated decision-making;

Having demonstrated a fundamental lack of understanding and judgment;

We demand the resignation of Gil Kerlikowske; and the legalization of marijuana.","2011-10-28 22:58:53",1236,2678,22322,25000,Closed
4eab70a4cf436a8b4d00005b,"Reform the FDA and remove all corrupt FDA officials","The FDA is one of the most corrupt government agencies and works primarily to protect interests of the pharmaceutical industry.  The FDA was put in place to protect the American people but it has been doing quite the opposite. An authenticated letter from federal scientists even tried to expose the corruption.  They wrote:

"The purpose of this letter is to inform you that the scientific review process for medical devices at the FDA has been corrupted and distorted by current FDA managers, thereby placing the American people at risk." 

The letter went on to explain how agency managers use intimidation to squelch scientific debate, leading to the approval of medical devices whose effectiveness is questionable and which may not be entirely safe.  The FDA needs serious reform.

","2011-10-28 23:38:18",1241,1495,23505,25000,Closed
4eab75aeec309e527f000014,"Actually take these petitions seriously instead of just using them as an excuse to pretend you are listening","Although the ability to submit petitions directly to the White House is a noble and welcome new feature of the current administration, the first round of responses makes blatantly clear the White House intends to just support its current stances and explain them with responses everyone who has done any research already knows.

An online petition is not meant as a replacement for using a search box in a web browser. We the People, those who grant you the power to govern in the first place, are requesting changes in policy directly, circumventing legislators who already do not listen to us. We the People request you govern FOR us, which means actually listening to us and actually acting in our interests instead of special interests.

You are not above us. You ARE us. Govern accordingly.","2011-10-28 23:59:01",1246,37586,0,25000,Reviewed
4eab985d53b2cf9e4b00004f,"Replace Gil Kerlikowske","We the people demand that the Director of the Office of National Drug Control Policy, Gil Kerlikowske, immediately be replaced.

Drug Czar Gil Kerlikowske chose to respond to eight petitions with more than 150,000 signatures regarding cannabis law reform with one blanket response, a response riddled with more of the same stale rhetoric and exaggerations about marijuana use, a response completely disconnected from the will of the people.

We ask that Gil Kerlikowske be replaced as the Director of the Office of National Drug Control Policy, with someone more qualified to develop modern, sensible drug policies, and lead our nation into a brighter, more honest, and less corrupt future.","2011-10-29 02:30:37",1251,1669,23331,25000,Closed
4eac259c709f03465f00002b,"Reopen MAVNI - a program that enables Department of Defense to close a critical skills gap in securing the United States","Military Accessions Vital to the National Interest (MAVNI) enables US military to recruit foreign nationals with critical language and cultural skills who have been legally present in US for at least 2 years. MAVNI admitted soldiers briefly in 2009 and was a resounding success. It saved DoD hundreds of thousands of dollars and is endorsed by military and congressional leaders. However, for the past 19 months MAVNI has been held up by DoD bureaucracy. 

MAVNI applicants are passionate about serving the US. They possess the language, regional and cultural skills that Secretary of Defense Panetta has called “enduring warfighting competencies that are critical to mission readiness in today's dynamic global environment.”

We request your help to overcome bureaucratic barriers and reopen MAVNI.","2011-10-29 12:22:12",1256,920,24080,25000,Closed
4eac3d734bd504d45d00002b,"Ban the use of Tear Gas on citizens.","We The People of the United States of America petition the government to Ban the use of Tear Gas on Citizens.

"Tear gas, formally known as a lachrymatory agent or lachrymator, is a non-lethal chemical weapon that stimulates the corneal nerves in the eyes to cause tearing, pain, and even blindness." [1] 

The use of Tear Gas in war is prohibited under the terms of the Chemical Weapons Convention, however the use of it on civilians is allowed.[2]

[1] - http://en.wikipedia.org/wiki/Tear_gas
[2] -http://www.cwc.gov/regulations_state_amendments_03_text.html","2011-10-29 14:09:17",1261,2157,22843,25000,Closed
4eac3e533d2d5bfe6d000044,"Respond to each of the 7 marijuana related petitions individually instead of one canned response.","The white house recently responded to 7 marijuana petitions with one canned response.  The response did not address each issue separately.

It is disrespectful of the thousands of people who signed each petition to dismiss it in such a generic way.

We would like to hear from the white house what its position is on each petition. ","2011-10-29 14:06:24",1266,3294,21706,25000,Closed
4ead74a38d8c37766a000045,"Stop lying","about marijuana
about why we intervene militarily in other countries
about the crimes of past admins
about how the Patriot Act is interpreted
about food safety
about the health hazards in the Gulf post spill
about safety levels and Japan’s nuclear accident
about hiring lobbyists
about an open government
about respecting states’ rights
about stopping terrorists
about airport body scanner safety
about job creation
about the state of the Union
about too big to fail corporations
about hydrofracking
about corporate personhood
about conflicts of interest at the Federal Reserve and Supreme Court
about the health industry
about the effectiveness of using contractors to support our military
about susceptibility of economy to financial speculators
about taking petitions seriously
Mostly stop lying","2011-10-30 12:35:00",1271,1836,23164,25000,Closed
4eadf93ffb7528ae2e00007b,"prohibite ICE and/or CCA from building any sort of prison facility in Southwest Ranches.","The residents of Southwest Ranches, Pembroke Pines and Weston are completely against the building of an immigration detention center in SWR.  Thousands of families have chosen this area for their families because they thought it was safe.  The proposed location for this facility is less than 2.5 miles away from FOUR different schools.   
This project will have a significant negative impact on the environment.   Millions are being spent trying to restore the Everglades, Florida’s most important natural resource for water.  This facility will use substantially more water resources than a commercial or residential project would.    
This project will certainly lower our property values and severely increase traffic in what is supposed to be a rural area.  This is not an appropriate location!","2011-10-30 21:59:46",1276,293,24707,25000,Closed
4eae770a4bd504242400000f,"Help veterans and their families that are in need of support from their government in the time of need.","This will help Veterans and their families get then help they need the most from their country that they fought for when it was in a time of need. There are several families that are not getting support from the Veterans Administration for diseases and other medical conditions in results from serving on foreign soil. Like Cholangiocarcinoma (Bile Duct Cancer) caused by a parasite that has been identified in Asia. The symptoms take 30 years to show up and by that time many of the Veterans are dying or have died from this while waiting for approval from the V.A.. Many of the families are still waiting for help from the government to pay for medical bills that rack up while their loved ones die from this cancer. I am a son of a Veteran that has this cancer and we need all the help we can get.","2011-10-31 06:37:06",1281,332,24668,25000,Closed
4eae9fb62ee8d05f30000012,"Repair and modernize America’s crumbling public schools.","Here’s what you’ll find in too many public schools: “Classrooms” fashioned out of storage rooms because of overcrowding. Extreme temperatures, mold, falling ceilings, and other unsafe and unacceptable conditions.  

 All students are entitled to a safe and healthy learning environment. We need immediate action to turn crumbling schools into healthy, high-performing learning environments for students and educators. 
 Renovation, modernization, and the introduction of energy-efficient systems and cost-effective materials will create good American jobs and save dollars that can go back into classrooms.

 Send a positive message to our children: that their education is worth the effort to fix our schools.   

You told the president; now tell your members of Congress: http://tinyurl.com/6ebldty","2011-10-31 09:24:41",1286,4412,20588,25000,Closed
4eaeb4aecf436ac035000023,"We believe the Obama Administration should require the FDA to enforce the Food, Drug, and Cosmetic Act with pet foods.","We believe the Obama Administration should require the FDA to enforce the Food, Drug, and Cosmetic Act (The Act) - as it is written - with pet foods.  The Act clearly defines 'food' as that for humans and animals.  Yet currently, the FDA allows materials from diseased animals, euthanized animals, downer animals, rodent feces and insect infested foods to be processed into pet foods/animal foods.  Consumers are not warned their pet food purchases could contain illegal ingredients and often pay premium prices for such.

We request the FDA be required to abide by The Act or request the FDA to require all pet foods that do not provide certification of compliance of The Act to be clearly labeled with a warning to the consumer. To learn more visit http://tinyurl.com/3spmd22
","2011-10-31 10:51:38",1291,1188,23812,25000,Closed
4eaf25b88d8c37321c000079,"Stop the E-PARASITE Act.","This Bill would allow essentially allow A Great Firewall of America and would be a shameful desecration of free speech and any sort of reasonable copyright law. The new Law would allow copyright holders to force websites which have any copyrighted material to be blocked by ISP companies around the country, without requiring that the websites be given time to take the offending material down. It would also put pressure on ISP companies to monitor their users like never before, a gross invasion of privacy. This bill is a direct assault on a free internet and a shameful attempt by copyright lobbyists to destroy net neutrality. Essentially it's a censorship law that would end the internet as we know it in America.","2011-10-31 19:02:20",1296,53314,0,25000,Reviewed
4eaf4c6bcf436aab0f00008a,"Offer a response to marijuana legalization petitions that isn't written by someone legally required to oppose them.","Your response to the petitions regarding marijuana legalization was written by Gil Kerlikowske, who, as the Director of the Office of National Drug Control Policy (ONDCP), is legally required by the Office of National Drug Control Policy Reauthorization Act of 1998 to oppose legalization of marijuana and other illegal drugs, regardless of the facts relating to their use and effects.

(See sec. 704 of the act: Among the duties of ONDCP directors is to "take such actions as necessary to oppose any attempt to legalize the use of a substance (in any form) that -- (A) is listed in schedule I of section 202 of the Controlled Substances Act (21 U.S.C. 812); and (B) has not been approved for use for medical purposes by the Food and Drug Administration")

This is clearly a conflict of interest.","2011-10-31 21:56:38",1301,4760,20240,25000,Closed
4eaf7e4acf436a312b00000d,"Federally recognize the United Houma Nation.","The United Houma Nation has sought federal recognition for decades. The tribe has been recognized by state and foreign governments as an Indian tribe. In fact, Houma children were forced to attend a segregated Indian school until the Civil Rights Act of 1964.

Located along Louisiana's Gulf Coast, the Houma Indian culture and community depend on the wetlands. The BP spill has devastated the Houma. However, BP denied the Houma's claim because they are not federally recognized.

The National Association for the Advancement of Colored People (NAACP) recommends the United Houma Nation be recognized to preserve the Houma’s culture. An NAACP report stated the oil industry lobby is blocking their request because they want access to lands that would be protected under the federal designation. 
","2011-11-01 01:51:02",1306,5777,19223,25000,Closed
