PID,title,body,pcreated,serial,signature_count,signatures_needed,signature_threshold,status
4f8839b7b2563627240000b0,"Sea of Japan -the authentic history in our textbooks! We are teaching our children the authentic history, so why change?","We should definitely keep the Sea of Japan as it is now.

	1. Contrary to the Korean claim that Japan changed “East Sea” to “Sea of Japan” in 1928, the Sea of Japan has always been the Sea of Japan, since the beginning of time.

	2. South Koreans are under heavy communism influence because of communist North Korea, and have forgotten about the massive American blood spilled to defend them from the North Korean invasion aided by Russians and Communist Chinese during the Korean War in the '50s. Now they want the American forces out. Their extreme ethnocentricity blinds them and they want to rewrite history per their stories. That is plain wrong.

Please join us and sign this petition to stop FALSIFYING history in our textbooks. Our children have right to keep learning a TRUE history!","2012-04-13 11:13:21",2321,29160,0,25000,Reviewed
4f883d8911fb9c9f4f000054,"support conservation, recreation, science, and personal freedom by mandating public access to caves on public lands","Whereas all scientific evidence shows that White Nose Syndrome (WNS) is spread by bat-to-bat contact and that any human vector, if it exists at all, is insignificantly small,

Whereas that vector, if it exists at all, can be easily eliminated through cleaning gear with hot water, which destroys any chance of spreading the fungus,

Whereas closing caves has done nothing to stop the spread of WNS,

Whereas caves that are closed to access by responsible parties are repeatedly defaced and damaged by irresponsible parties,

Whereas many public caves are unique natural, recreational, and scientific resources, 

We call upon the Obama administration to keep publicly-owned caves open to the public for the protection of these caves and the resources they contain.
","2012-04-13 10:58:06",2326,619,24381,25000,Closed
4f8b82a88d8c37e570000028,"explain in detail, its continued push for a $100 per segment aviation user fee.","In the interest of transparency and in order to maintain a healthy aviation industry, we request that the White House explain how it calculated that a $100 per flight segment user fee is a fair contribution to fund FAA. 

We further request an explanation of how the White House determined that the most effective method of collecting this user fee should be through a new, yet-to-be-developed taxing system, rather than the successful aviation fuel tax currently in place.","2012-04-16 14:31:56",2331,5822,19178,25000,Closed
4f8d85fe4bd504097c00006e,"Changing Lives One Keystroke at a time, with the Virtual Keyboard available for those with Disabllities","While trying to resolve my laptops malfunctioning keyboard, I discovered a tool called the Virtual Keyboard (VK) which allows a VK to appear on a computer screen and the mouse can be utilized to type characters.I had an employee who suffers from Cerebral Palsy and was using a mouth stick to key characters from a standard keyboard for 5 years. I introduced the VK to him, within ten minutes; the mouth stick was thrown in a corner. Within a week, the VK was made a Best Practice for the IRS. I receive emails of thanks from employees. Some have long term disabilities like arthritis; others have short term restraints like a broken arm.The VK can change lives by making work easier for disabled employees increasing productivity. Awareness of the VK should be provided to all government agencies. 
","2012-04-17 11:09:31",2336,351,24649,25000,Closed
4f8fa47ab25636b340000003,"Make Election Day a National Holiday.","Recognize Election Day as a federal holiday.  

Pass legislation that establishes Election Day as a "major" holiday, to be grouped with holidays that celebrate the foundations of this country, including Independence Day, Memorial Day, and Labor Day.

Educate the general public about the issues, current and proposed legislation, and Election Day procedure.  

Encourage private businesses to close for the day in order to allow their employees to vote.

Combat low voter turnout through education and greater opportunity.  
","2012-04-19 02:13:24",2341,2064,22936,25000,Reviewed
4f91b06a8d8c37173a00001e,"Veto CISPA if it makes it past both houses of congress. This legislation is harmful to the American people.","This legislation is not in the interest of the American people. We did not ask for it, nor will it help any sort of majority in any way. The ramifications of this proposed law will move us as a nation, one step closer to totalitarianism. Please stop protecting corporations and business interests over those of the people who put you into office. ","2012-04-20 14:57:13",2346,5310,19690,25000,Closed
4f9231b12ee8d04a7a000027,"Save the Post Office","The U.S. Post Office was established in the US constitution. It is the cornerstone of our society. It greatly aids the functioning of small businesses in America by helping them to get products to others in both the United States and overseas. The post office is would be functioning if not for a 2006 law that requires it to fund its pension program 75 years in advance. We are asking the president to sign an executive order to no longer enforce that 2006 law. This would allow the post office to return back into the black and to make arrangements for its future. America cannot wait for a dysfunctional congress to get around to fixing this problem. Please consider signing this executive order thousands of post office jobs and the function of hundreds of small businesses count on it.","2012-04-21 00:05:32",2351,838,24162,25000,Closed
4f948addb256362251000087,"Provide Motorists' Adequate Vehicle 'Black Box' Consumer Protection","Rulemaking to establish a new Federal motor vehicle safety standard to mandate the installation of Event Data Recorders (EDR) in light vehicles lacks adequate consumer protection for preventing unauthorized access to the data stored on a vehicle's EDR to protect the security, integrity, and authenticity of the data in order to retain scientific and probative value. Therefore, amend 49 CFR 563: EVENT DATA RECORDERS § 563.13 Connector Lockout Apparatus (CLA). Each manufacturer of a motor vehicle equipped with an EDR shall ensure that a connector lockout apparatus (CLA) for securing access to the data stored in the EDR that are required by this part is attached to the vehicle's diagnostic link connector (DLC)  at the point of motor vehicle sale, including leased and rented motor vehicles.","2012-04-22 19:04:45",2356,806,24194,25000,Closed
4f95e61f709f03303c000012,"Recognize Armenian Genocide","I am filing this petition on behalf of Armenian people and specifically Armenian communities in US. This petition is about recognition of Armenian Genocide committed by Ottoman Empire in 1915-1923. As a result of that atrocity against humanity and the whole Armenian race, over one and half million of innocent people have been brutally murdered and over two millions were expelled out of their homeland by "Young Turks". . To date, twenty countries and forty eight states of the United States of America officially recognized Armenian Genocide.We plead for acceptance of Armenian Genocide and restitution of Armenian lands as it will change Armenian people's lives and will prevent future genocides; and for the few survivors who are still alive it will mean that justice has finally triumphed.","2012-04-23 20:30:48",2361,591,24409,25000,Closed
4f96079211fb9c0935000021,"Correct service records for all who were punished over the DoD anthrax vaccine when the mandatory program was illegal.","The Department of Defense (DoD) anthrax vaccine was experimental and the immunization program illegal until December 19, 2005 when the FDA finally licensed the drug. Congressional Report 106-556 and the court findings referenced below upheld the illegality and the FBI confirmed the anthrax letter attacks' motive was intended to resuscitate the “failing” program. This Petition appeals to the President's sense of justice and his authority as Commander in Chief to expunge adverse personnel actions for anyone previously sanctioned for refusing to comply with the illegal anthrax vaccine mandate.

http://www.gpo.gov/fdsys/pkg/CRPT-106hrpt556/html/CRPT-106hrpt556.htm

http://anthrax.mil/documents/library/AnthraxSJtOrder_Op.pdf

http://www.justice.gov/amerithrax/docs/amx-investigative-summary.pdf","2012-04-26 03:22:26",2366,281,24719,25000,Closed
4f97135eb256368619000072,"determine the nonprofit status of American Legislative Exchange Council (ALEC)","American Legislative Exchange Council (ALEC) reports to be a 501(c)(3) non-profit organization. As a 501(c)(3) its donors receive tax deductions for their charitable contributions. ALEC actively engages in lobbying for legislative causes. We believe that this status should be reviewed by the internal revenue service because Section 501(c)(3) organizations are subject to limits or absolute prohibitions on engaging in political activities. We, the undersigned, believe that ALEC may have violated this status by lobbying local, state and federal government for passing of legislation. In addition, we believe that ALEC has made frequent political contributions. We the undersigned call on the Internal Revenue Service to fully investigate the organization known as ALEC .  ","2012-04-24 16:57:29",2371,786,24214,25000,Closed
4f9767082ee8d01a0b00005c,"Keep MBDA Regional Offices Open. These offices support the growth and development of minority owned businesses","The MBDA Regional Offices create and facilitate growth and mentoring for Minority Owned Businesses. This is not a funciton that can realistically happen from Washington, DC. These offices understand their regional needs, opportunities, businesses and agencies. Most importantly, they understand the types of minority buisnesses in the region, the skillsets and the development requriements. They have built a rapport of strong relationships and serve as a resource to the MBDA Business Centers as well as other organizations in the region. These offices are often the FIRST interface for minorty owned businesses with the federal government for obtaining business and understanding government requirements. If job creation is so important, why remove something that works in the minority communities?","2012-04-24 23:04:44",2376,157,24843,25000,Closed
4f97787b11fb9c526500000f,"STOP 1%-led TPP negotiations and defend the rights of us, the people, NOT bankers and corporate America. #TPP","TPP (Trans-Pacific Partnership) is a secretive, super free trade pact covering 24 fields including medicine, insurance, finance, investment, labor and government procurement, allowing corporations to exploit ordinary people. This is economic colonization by corporations. This trade pact puts the interests of corporations above that of the citizens of signatory nations. It enables corporations to sue governments if their profits are threatened by government action to protect citizens.
If TPPA is introduced, jobs will be lost, the price of medicine and insurance fees will go up, wages will get lower, working conditions will erode, the environment will be degraded, and the gap between the rich and the poor will widen for all member nations!
Stop TPP of 1%, by 1%, for 1%!","2012-04-25 00:26:28",2381,1818,23182,25000,Closed
4fa00c80cf436ab10e000010,"End the unconstitutional National Day of Prayer, which violates the 1st Amendment. God & government are a dangerous mix.","Congress, in 1952, abridged freedom of conscience when, at the instigation of Rev. Billy Graham, it designated a National Day of Prayer, ordering the President to proclaim "a National Day of Prayer, on which the people of the United States may turn to God in prayer and meditation at churches, in groups, and as individuals.” 

The U.S. President has neither the moral nor the constitutional authority to dictate to Americans to pray, much less to tell citizens what to pray about or set aside an entire day for prayer. 

Whether to pray, or believe in a god who answers prayer, is an intensely precious, personal decision protected under our First Amendment as a paramount matter of conscience.

Don’t let Christian evangelicals hijack our secular Constitution. 
","2012-05-01 12:40:05",2386,4415,20585,25000,Closed
4fa0ca5acf436a6058000017,"defend the civil rights that are being violated here in the U.S. on our Native American tribal lands with no due process","Our people are suffering at the hand of rogue executive committees on Native American tribal lands. Our civil rights are being violated with no due process. The BIA and DOJ have snubbed their noses to this growing problem. Thousands of Native Americans are stripped of their rights and heritage. It is time for Congress to step in and join us in a "sign on " letter to bring the attention this matter deserves. How can we defend one Chinese man when thousand of our Native American are suffer from these people who have corrupted our tribes, and they think cannot be stopped. Please help us in our fight to get our voices heard. We have spoken to many great Senators and Congress people and have gotten great response.  Please visit "Pechanga Blog" to see the latest information. ","2012-05-02 01:59:55",2391,650,24350,25000,Closed
4fa128924bd504463a000013,"Reopen the search for a C-54 military aircraft that went missing over Yukon Territory with 44 people on board, 26 Jan 50","On 26 Jan 50, a C-54 aircraft with 44 crew and passengers failed to arrive at Great Falls MT on its flight from Anchorage AK. A massive joint US-Canadian search was conducted over Yukon Territory and British Columbia Canada, but the aircraft and its victims were never found. Today, the government considers the search over, unless new actionable evidence is produced.  In stark contrast, our search for the Missing in Action, those missing due to combat engagement, continues and will never be abandoned. With all due respect to MIAs, ALL of our servicemen and women and their dependents deserve this same commitment. Our government possesses the resources to find this aircraft and the time to act is now!  Please sign this petition and "like" the Facebook page, www.facebook.com/operationmike. ","2012-05-02 08:43:44",2396,668,24332,25000,Closed
4fa152c3709f03051a00001a,"Withdraw USDA's proposed rule, Modernization of Poultry Slaughter Inspection (Docket #FSIS-2011-0012).","We believe this proposed rule should be withdrawn because:
(1) Poultry inspection should be performed by trained USDA inspectors, not company employees. (2) The proposal to increase inspection line speeds up to the point where the remaining USDA inspectors must inspect three chickens per second is absurd. Such increased line speeds would only benefit the chicken slaughter industry, not American consumers. (3) USDA's claim that the new poultry inspection system will improve food safety is untrue. Food & Water Watch's analysis of USDA's HIMP pilot project - the pilot project upon which the proposed new inspection system is based - revealed that large numbers of food safety defects are routinely missed when inspection tasks are performed by company employees instead of USDA inspectors.","2012-05-02 11:43:37",2401,17562,7438,25000,Closed
4fa2d8a4709f03bb75000071,"Exercise the powers vested in you to see to it that Jacob Ostreicher, a US citizen, is freed from Bolivia.","Jacob Ostreicher, an American, has been suffering in a Bolivian prison for more than 11 months. He is being held without a shred of evidence. 

On 09/23/2011, the judge ordered his release based on evidence submitted by the defense, just days later the same judge reversed his decision and was promoted. A new judge resigned after 5 scheduled hearings.

We expect that in times of need, our government will be serious about, adamant enough, and powerful enough, to provide its citizens protection and asylum. 

In your capacity as President of the U.S., we urge you to exercise the powers vested in you, to see to it that Jacob does not spend another day in this anarchic prison

With all avenues having been exhausted, it is up to you, Mr. President to make sure an innocent man walks free.","2012-05-03 15:58:23",2406,35958,0,25000,Reviewed
4fa2e9a04bd504c75a000008,"Change the EO 13473 2 year eligibility start date from Date of PCS Orders to Report Date. Actually set realistic term.","I am a military spouse, I am unemployed as a result of a process inefficiency regarding this EO 13473. I lost my eligibility during the interview process. I was selected and offered a job, given a start date and completed hiring paperwork. The job offer was rescinded because my 2 year window of eligibility based on PCS order date expired during hiring process. If the report date was used I would still be eligible. There is a two and half month difference in time between PCS order date and report date.I am told I could have applied for jobs prior to reporting. That is unrealistic, I wouldn't have been present to participate in interview process or to accept immediate appointability so that suggestion is inefficient. Some spouses lose up to 6 months! I want my two months back.","2012-05-03 16:30:57",2411,319,24681,25000,Closed
4fa324df8d8c376a5800000d,"Protect the First Amendment Rights of Citizens to Record Law Enforcement Officers in Public Without Getting Arrested.","The First Amendment has come under assault with countless incidents of federal, state and local law enforcement officers threatening, intimidating, assaulting and arresting citizens for the mere act of recording in public.

While these incidents were highlighted during the Occupy protests, they started in earnest after the 9/11 terrorist attacks under the guise of keeping our country safe from terrorists.

But cameras are not weapons. 

In many cases, they are the only things that hold officers accountable for their actions, which is why there have been countless incidents of officers unlawfully confiscating cameras and/or deleting footage.

We are not asking to change the law. We are asking for the existing laws to be respected.

We are asking for the First Amendment to be respected.","2012-05-03 21:27:05",2416,2193,22807,25000,Closed
4fa3ed1dcf436aef46000005,"Allow non-violent marijuana drug offenders to serve 65% of federal sentences as oppose to the current 85%.","Currently all federal inmates have to serve a minimum of 85% of their sentence. Changing this requirement to 65% for all non-violent marijuana offenders would greatly reduce the injustice imposed by the harsh and unfair mandatory minimum laws. There are non-violent marijuana offenders serving more time then violent offenders, and this is a great injustice that needs to be corrected. This change would not leave the crime unpunished, but instead make the sentencing more suitable. This will allow individuals to return back to society quicker. Also, allow drug program 18 month reduction and 12 month half way house assignments to ensure better rehabilitation. It will reduce the enormous strain mandatory minimum sentences place on families and the America dollar. This change is long overdue.","2012-05-04 11:04:53",2421,325,24675,25000,Closed
4fa5d3102ee8d0a474000017,"shut down ALL nuclear reactors 1 at a time, safety as the reason.  Must be made to withstand Earthquakes / Tsunamis.","Recently, (May 5 2012) Japan has announced the SHUT DOWN of its final nuclear power plant.

The entire country is now operating free from nuclear power. 

Here is the MSM news story confirmation released May 5, 2012:

http://news.yahoo.com/thousands-march-japan-shuts-off-nuclear-power-071425811--finance.html

This petition of redress to the Whitehouse, specifically  to President Obama, is aimed to mimic the reduction, and eventual ELIMINATION of all nuclear power plants within the Continental United States of America.

The shutdown process: Close each nuclear plant when it comes up for safety review.  The reason for shutdown will be for the plant to assure it is 100% earthquake / tsunami proof.

If the plant is not deemed 100% Earthquake / Tsunami proof, then it will be permanently closed.","2012-05-05 21:38:32",2426,1301,23699,25000,Closed
4fa7e9282ee8d0cc12000005,"remove the statue related to the comfort women issue and not support any international harassment of the people of Japan","False accusations regarding the South Korean comfort women issue have disgraced the people of Japan for decades. 

Over the past few years it has come to light that many of the original charges were false or completely fabricated. Yet despite this new information, the United States continues to lend credence to the original false charges by memorializing the comfort women in a statue in Virginia and a street name in New York. Not only is this perpetrating historical untruths, but it also leads unnecessary racial conflict and suffering of people of Japanese ancestry. 

We strongly request President Obama to remove the statue and not to support any international harassment related to this issue against the people of Japan.

","2012-05-07 11:32:44",2431,1523,23477,25000,Closed
4faa6b0eb256369f0d000013,"Exclude hot dogs and other obesity- and cancer-causing foods from photo ops that feature the president.","The nonprofit Physicians Committee for Responsible Medicine believes that food-related photo ops featuring the president, vice president, first family, or members of the cabinet routinely conflict with government health messages. The photos often present foods that contribute most strongly to cancer, obesity, and premature mortality in a favorable light. A typical photo op depicts a president entertaining a foreign dignitary, with both stuffing processed meats or hamburgers into their mouths for the assembled cameras. All recent presidents have been involved in such events. There is no justification for encouraging Americans to eat foods that will harm them and their children. Instead, photo ops that include food should portray government officials eating healthfully.","2012-05-09 09:22:37",2436,2591,22409,25000,Closed
4fabb513cf436a2f41000028,"Make a Angie's Law so when an addict asks for help they are guaranteed treatment not turned away due to lack of space","TODAY WE HAVE LAWS IF YOU WALK INTO AN ER YOU ARE NOT TURNED AWAY BECAUSE OF YOUR INABILITY TO PAY, IF YOU STATE YOU INTEND TO HARM YOURSELF YOU ARE FOUND HELP , BUT IF AN ADDICT DRUMS UP  COURAGE TO WALK IN AND ASK FOR HELP THEY GET TURNED AWAY DUE TO "SORRY BUT WE HAVE NO OPEN BEDS" EACH LIFE THAT IS SENT BACK OUT THOSE DOORS WITH CRUSHED HOPES ARE GREETED BY THEIR DEMONS EVEN STRONGER MY HEART BREAKS AT THE COUNTLESS LIVES THAT HAVE BEEN LOST JUST BECAUSE WE HAVE NO LAW TO PROTECT THEM AND ASSURE THEM OF THE HELP THEY ARE ASKING FOR MY DAUGHTER ANGIE WENT 2 DAYS IN A ROW ASKING FOR HELP, WE ARE SORRY BUT WE HAVE NO BEDS, SHE WANTED AND NEEDED HELP, THE SYSTEM FAILED HER AND SHE DIED THE SAME NIGHT SHE WAS THERE LAST BEGGING FOR HELP PLEASE HELP ME GET "ANGIE'S" LAW PASSED ","2012-05-10 08:44:38",2441,459,24541,25000,Closed
4fac2c518d8c373536000008,"Remove the monument and not to support any international harassment related to this issue against the people of Japan.","False accusations regarding the South Korean comfort women issue have disgraced the people of Japan for decades. Over the past few years it has come to light that many of the original charges were false or completely fabricated.

Yet despite this new information, the United States continues to lend credence to the original false charges by memorializing the comfort women in a monument in New Jersey and a street name in New York. Not only is this perpetrating historical untruths, but it also leads unnecessary racial conflict and suffering of people of Japanese ancestry.

We strongly request President Obama to remove the monument and not to support any international harassment related to this issue against the people of Japan.
				","2012-05-10 17:53:44",2446,47525,0,25000,Reviewed
4fad4814b25636b372000021,"Enable American energy independence by retaking the lead in Thorium energy & Rare-Earth dependent hi-tech manufacturing.","End energy imports with Thorium Molten-Salt Reactors. Th-MSR convert abundant Thorium, rarer Uranium & unwanted Plutonium into energy. Efficiently & safely.

China’s "Advanced Nuclear Cooperation" with the US EXCLUDES all Thorium related R&D. China's expressed intent is to capture all MSR related IP, working from Oak Ridge’s now public research (paid for by US taxpayers).

Thorium regulation severely restricts Thorium and Rare Earth development. Heavy Rare Earths are essential for high-tech manufacturing jobs. WTO action is no substitute for reliable domestic supply.

With a reliable supply of heavies and inexpensive clean energy to run factories, manufacturers will flock to USA.

Reform Th/REE regulation for energy independence & high-tech manufacturing independence.

ThoriumPetition.com","2012-05-11 13:18:42",2451,443,24557,25000,Closed
