PID,title,body,pcreated,serial,signature_count,signatures_needed,signature_threshold,status
50a1b710a9a0b1ee3b000014,"Peacefully grant the State of New Mexico to withdraw from the United States of America and create its own NEW government","As the founding fathers of the United States of America made clear in the Declaration of Independence in 1776:

"When in the Course of human events, it becomes necessary for one people to dissolve the political bands which have connected them with another, and to assume among the powers of the earth, the separate and equal station to which the Laws of Nature and of Nature's God entitle them, a decent respect to the opinions of mankind requires that they should declare the causes which impel them to the separation."

"...Governments are instituted among Men, deriving their just powers from the consent of the governed, that whenever any Form of Government becomes destructive of these ends, it is the Right of the People to alter or abolish it, and institute new Government..."

","2012-11-12 21:58:08",3676,5434,19566,25000,Closed
50a1bfafc988d4633b000005,"Deport Everyone That Signed A Petition To Withdraw Their State From The United States Of America.","Deport Everyone That Signed A Petition To Withdraw Their State From The United States Of America.","2012-11-12 22:35:44",3681,29650,0,25000,Reviewed
50a1c42cb15a7a490c000019,"Support HR 2052 Ft McClellan Health Registry Act To Help Veterans","To help Ft McClellan veterans who were stationed at Ft McClellan, Alabama and who were exposed to toxic chemicals without their knowledge. These Ft McClellan veterans are currently very sick, many have already died and are now dying because of exposure to toxic chemicals while at Ft McClellan.

HR 2052 Ft McClellan Health Registry Act is currently in legislation in Congress and is stalled in committees. We need to move it out of committees and onto the House floor for a vote. We, Ft McClellan veterans, need this bill. We did not know that we were being exposed to toxic chemicals while at Ft McClellan, Alabama.

We need HR 2052 Ft McClellan Health Registry Act to be moved out of committees and onto the House floor for a vote now! This bill is deliberately being stalled in Congress.","2012-11-12 22:55:59",3686,1179,23821,25000,Closed
50a1caa26ce61ce464000007,"Repeal Obamacare. It is killing jobs in this country. Thousands have already lost their jobs because of it.","Please repeal Obamacare, it is destroying jobs in this country and is already taxing businesses into closing. If you care even a little about the middle class as you so adamantly said you did during your reelection campaign, than you will repeal it so the middle class can get back to work. ","2012-11-12 23:24:44",3691,64655,0,25000,Reviewed
50a1dd7acde5b83e28000000,"Allow the city of El Paso to secede from the state of Texas. El Paso is tired of being a second class city within Texas.","El Paso has little in common with the rest of Texas. Its demographics are more similar to New Mexico. El Paso is also proud to be part of the United States and wants no part of a state whom publicly contemplates secession from our great nation.","2012-11-13 00:45:18",3696,1415,23585,25000,Closed
50a1fa84ee140fb768000012,"Peacefully grant the State of Washington to withdraw from the United States of America and create its own NEW government","As the founding fathers of the United States of America made clear in the Declaration of Independence in 1776:

"When in the Course of human events, it becomes necessary for one people to dissolve the political bands which have connected them with another, and to assume among the powers of the earth, the separate and equal station to which the Laws of Nature and of Nature's God entitle them, a decent respect to the opinions of mankind requires that they should declare the causes which impel them to the separation."

"...Governments are instituted among Men, deriving their just powers from the consent of the governed, that whenever any Form of Government becomes destructive of these ends, it is the Right of the People to alter or abolish it, and institute new Government..."","2012-11-13 02:46:51",3701,4631,20369,25000,Closed
50a245b100e579bf50000016,"Renew the tax cuts for 98% of all taxpayers NOW.","The average American middle class taxpayer needs ALL the expiring tax cuts extended. We cannot afford the Republican obstruction to hold these extensions hostage so they can fulfill their main concern - tax cuts for the top 2%.
*The Republicans will once again talk about job creators - you know, that phantom group who has not shown up during the first 10 years of the bush subsidy to the ultra-wealthy. 
*They will complain about the uncertainty faced by taxpayers not knowing what their 2013 taxes will be - obviously just concerned about the top 2% not knowing since they have a chance right now to do away with that uncertainty for 98% of the taxpayers. 
And sadly some will blindly believe these LIES - AGAIN!
It's time to help the average American, whether the Republicans want to or not.","2012-11-13 08:21:13",3706,1519,23481,25000,Closed
50a24e1fa9a0b1023b000005,"put green card applications that are filed by same sex bi national couples on hold to provide temporary relief","Right now married same sex bi-national couples are unable to obtain a green card for the foreign partner due to DOMA. It is now expected that the Supreme Court will resolve this issue by June 2013. However, these couples suffer from the discriminatory effects of DOMA everyday. The right thing to do is to put green card applications that are filed by married same sex bi-national couples on hold so that they could have some relief until then. Since doing so doesn't violate DOMA, there is no good reason not to take this step. ","2012-11-13 08:49:29",3711,1154,23846,25000,Closed
50a2541ccde5b8e61c000012,"Prevent Genetically Engineered & Modified Organisms from being introduced into our bodies, food supply & environment","Consumption of Genetically Modified/Engineered Foods, Plants, Animals & Vaccines have not been conclusively proven to be harmless to humans. Animals fed GMO corn have been rendered INFERTILE and have grown large tumors. GMO pollen has contaminated the crops of unsuspecting farmers whose seed stock and livelihood are now being destroyed by GMO Patent holders. Genetically modified salmon have been released into the wild to breed. Pandora's Box. These heinous actions constitute an assault upon our farmers, our bodies, against Mother Earth, against Creation. Additionally, many European countries refuse to accept US crops because of GMO contamination therefore causing economic hardship to our agricultural business.  No one is monitoring this vast experiment, this great transgression. STOP NOW","2012-11-13 09:27:18",3716,8558,16442,25000,Closed
50a25963704301f52500000f,"endorse Johnny Manziel, also known as "Johnny Football," for the 2012 Heisman Memorial Trophy Award.","WHEREAS Johnny Manziel, also known as "Johnny Football" has ushered in an age of collegiate football in America the likes of which we have never seen; and

WHEREAS Johnny Football has overseen the meteoric rise of Texas A&M in its first year in the SEC, in the first year of the Kevin Sumlin era; and

WHEREAS Johnny Football has statistically dominated all collegiate competition with his play on the field; and

WHERAS the Heisman Memorial Trophy Award is to be granted to the "most outstanding player in collegiate football" and makes no qualifications regarding classification;

NOW, THEREFORE, BE IT RESOLVED THAT:

The Office of the President of the United States, and indeed the whole of the free world, endorses Johnny Manziel for the 2012 Heisman Trophy. Gig'em Aggies.","2012-11-13 09:39:50",3721,828,24172,25000,Closed
50a26264cde5b8154600000d,"Support a Resolution of Expulsion of Mitch McConnell from the Senate for his disloyalty to the United States.","Under Article I, Section 5, clause 2, of the Constitution, a Member of Congress may be removed from office before the normal expiration of his or her constitutional term by an “expulsion” from  the Senate upon a formal vote on a resolution agreed to by two-thirds of the Members of that body present and voting.

While there are no specific grounds for an expulsion expressed in the Constitution, expulsion actions in both the House and the Senate have generally concerned cases of perceived disloyalty to the United States. 

Since 1789, the Senate has expelled fifteen members.
","2012-11-13 10:19:36",3726,2113,22887,25000,Closed
50a27194c988d44c31000005,"Peacefully allow the states that have asked to secede to do so and form their own NEW nation together.","As the founding fathers of the United States of America made clear in the Declaration of Independence in 1776:

"When in the Course of human events, it becomes necessary for one people to dissolve the political bands which have connected them with another, and to assume among the powers of the earth, the separate and equal station to which the Laws of Nature and of Nature's God entitle them, a decent respect to the opinions of mankind requires that they should declare the causes which impel them to the separation."

"...Governments are instituted among Men, deriving their just powers from the consent of the governed, that whenever any Form of Government becomes destructive of these ends, it is the Right of the People to alter or abolish it, and institute new Government..."","2012-11-13 11:15:53",3731,18900,6100,25000,Closed
50a276a22f2c883f3800000a,"Allow someone other than the Office of National Drug Control Policy to address marijuana law reform.","Every petition regarding marijuana law reform has received responses from the Office of National Drug Control Policy. Each response has simply addressed the never-changing stance of this office. 

By law, the director of the ONDCP shall ensure... to take such actions as necessary to oppose any attempt to legalize the use of a substance listed in schedule I of section 202 of the Controlled Substances Act (21 U.S.C. 812).

We respectfully request a response from an official spokesperson of the Administration who is allowed by law to consider ALL available evidence and research on the issue of marijuana law reform.

Will the Administration respect states' rights where pro-marijuana laws have been voted in by the will of the People, pursuant to the 10th Amendment of the U.S. Constitution?

","2012-11-13 11:55:30",3736,1896,23104,25000,Closed
50a27857b15a7a673900000b,"Establish new legal system of motorcycle riding "Judges" who serve as police, judge, jury, and executioner all in one.","This is a petition to dissolve the current legal system and replace it with a single Hall of Justice, run by Judges; motorcycle-riding law officers who act as police, judge, jury, and executioner. ","2012-11-13 11:45:51",3741,3138,21862,25000,Closed
50a2798ab15a7a5d39000009,"Completely divest all support to the apartheid state of Israel","Peacefully withdraw all support, military, monetary and political, from the apartheid terrorist state of Israel. This state is racist in nature and leads the world in its human rights abuses toward the indigenous people of Palestine. Considering the constant establishment of new settlements on stolen land built by Israeli citizens, and the open-air concentration camp conditions in which the Israeli military keeps these Palestinian men, women and children, without regard to the protests of the majority of the world's countries, we, the people of the United States can no longer conscience the use of our tax dollars to support such inhumane action in our names.","2012-11-13 11:59:37",3746,1056,23944,25000,Closed
50a27e44ee140fbc41000006,"Save the lives to all Venezuelans in risk of Deportation by granting a Deferred Enforced Departure ( D.E.D )","We are asking for a humanitarian and very urgent petition to save the lives of many Venezuelans who are being deported; either by the special protection known as Deferred Enforced Departure (DED) or another policy that this administration consider convenient, since the government of Hugo Chavez has murdered several deportees after being imprisoned, humiliated, tortured and even dismembered because they are considered "homeland traitors" just for the fact they are coming from the U.S

Most of the Venezuelans in exile fear for their lives if returned to Venezuela 

Deferring the deportation of Thousands of Venezuelans will be a humanitarian measure which will be applauded by all Americans who will consider it a sign of strength and diplomatic savvy towards the enemies of this blessed land","2012-11-13 12:55:09",3751,320,24680,25000,Closed
50a27ee4688938d318000002,"Make Duncan Trussell the Emperor Of Planet Earth","We petition the Obama administration to construct an iron throne made of meteorites and incinerated pope penises upon which the new emperor of planet earth Duncan Trussell can reign supreme.

Attached to the throne should be a surgical straw connected to an endless quantity of fresh fetal stem cells upon which our Lord may suckle as the people of the world petition him for mercy or offer him their children and livestock.  



","2012-11-13 12:16:30",3756,337,24663,25000,Closed
50a280c3a9a0b1b62e000017,"President Obama: find and free SGT. BOWE BERGDAHL P.O.W. SINCE JUNE 30 2009 AFGHANISTAN.","We are supporters of Sergeant Bowe Robert Bergdahl, United States Army (dob 28 March 1986) of Hailey, Idaho, who was captured in Afghanistan on 30 June 2009 by a Taliban allied Afghan insurgent group called the Haqqani Network. He remains in captivity while the Taliban attempts to barter with America for his life in an effort to further its militant agenda. 
Our goals are to:
1) raise public awareness about Bowe's captivity 
2) to communicate to those U.S. Federal officials responsible for obtaining Bowe's release that the American people expect ongoing & effective action to be taken to return Bowe safely to the United States, 
3) to unite together as citizens to communicate to both Bowe & his family that America is in solidarity with them during this time of crisis. ","2012-11-13 12:33:16",3761,8770,16230,25000,Closed
50a283072f2c882639000013,"Exempt Religious objectors and institutions from supporting abortion and artificial contraception under Obamacare.","Amendment I - US Constitution

"Congress shall make no law respecting an establishment of religion, or prohibiting the free exercise thereof..."
 
Obamacare directly prohibits the free exercise of religion of millions of Roman Catholics, other religions, corporations and individuals by mandating direct financial support and cooperation in abortions and abortifacients.

Many Americans believe abortion is the murder of innocent human life - directly contrary to the religious teachings of most religious traditions.

We request an executive order exempting religious institutions and individual religious objectors from participation in any Obamacare mandates supporting abortion or artificial contraception directly or indirectly via insurance policies covering these abhorrent procedures.
","2012-11-13 13:00:33",3766,2242,22758,25000,Closed
50a2848fadfd95c61c000001,"Amnesty Is Not Immigration Reform!","Amnesty did not work in 1986, and it will not work now. Amnesty undermines respect for our nation's laws. We have too many unemployed, underemployed, and low wage workers already. We need to get more citizens off welfare and disability and back to work. Amnesty is not immigration reform. Amnesty encourages disobedience for any immigration standards set. Undocumented immigration brings unscreened security threats into the nation. 

Streamline the immigration process, but take the amnesty plan off the table! No more amnesty!

","2012-11-13 12:52:14",3771,3173,21827,25000,Closed
50a28af5b15a7aef0400001a,"Grant recognition to the Republic of Molossia as a presidential republic in free association with the United States.","The Republic of Molossia is a micronation, located within and surrounded by the United States.  We seek to enter into a Compact of Free Association with the United States, as a step toward eventual complete sovereignty.  We recognize and respect the United States as the home country from which Molossia was born in 1977, and wish to continue and formalize our current peaceful and fruitful relationship.  Engaging in a Compact of Free Association will prove beneficial to both nations and enable our peoples to enter a new era of growth and prosperity.","2012-11-14 18:33:07",3776,271,24729,25000,Closed
50a2917d688938481400000b,"Pardon Leonard Peltier","We, the undersigned citizens of the United States of America, the Citizens of the world, do hereby appeal and in fact DEMAND the unconditional release of Leonard Peltier, an Anishinabe-Lakota Indian currently serving 2 life sentences for the murders of two Federal Bureau of Investigation (FBI) agents. 

It is our belief, that Leonard Peltier is, in fact  a U.S. Political Prisoner who should be immediately and unconditionally released through a long awaited presidential pardon. 

Supporters include over 30 million people, human rights organizations such as; Amnesty International, the Southern Christian Leadership Conference, National Congress of American Indians, the Robert F. Kennedy Memorial Center for Human Rights, Nelson Mandela, Archbishop Desmond Tutu.","2012-11-13 13:34:18",3781,2531,22469,25000,Closed
50a29618688938a55a000011,"Peacefully grant the University of Illinois Chief Illiniwek back as the school mascot.","Chief Illiniwek was a symbol of the University of Illinois, and gave recognition to the Native American tribes of Illinois. Getting rid of this mascot is erasing a heroic and symbolic figure of utmost importance to Illinois history.","2012-11-13 13:51:34",3786,2899,22101,25000,Closed
50a29705a9a0b11623000006,"Sign into Law by Executive Order: EFCA as Originally Written; mandatory posting of NLRB Employee Rights; Prohibit RTW.","Popular support for the Employee Free Choice Act was over 70% when Congress had the chance to enact it. It is needed now more than ever to combat the abuses being suffered at the hands of CEO's and Corporations.  President Obama knows that Right to Work laws do not promote a healthy economy; in fact they do the exact opposite. A rising tide lifts all boats. When rights are hidden, stifled, and trampled upon it does very little to give people a helping hand out of poverty through their own hard work.  To help them become aware of their Federally protected rights at the workplace, the National Labor Relations Board's poster concerning Employee Rights under Section 7 of the Act should be a required posting at all jobsites.","2012-11-13 14:03:21",3791,708,24292,25000,Closed
50a29c3cee140f3432000002,"Create and Approve The MICHAEL JOSEPH JACKSON National Holiday.","For the following Reasons and Many More the undersigned, request a worldwide appreciation and or Holiday established in Michael Joseph Jackson's Name.

Please see http://www.scribd.com/doc/14283749/Michael-Jacksons-Humanitarian-Efforts-19792003 for more of Michael Jackson Humanitarian efforts world wide.

Michael Jackson has contributed time, money, merchandise, concerts, tickets, food, hospital equipment, to many people, hospitals, and charity organizations around the world. His acts as an Entertainer are tremendous and he has broken many records. His music carried messages of Healing and Love. His life was dedicated to making a difference and it is time that he was recognized for his humanitarian acts throughout the world. ","2012-11-13 14:25:18",3796,824,24176,25000,Closed
50a29e53c988d47d41000015,"Repeal the 10% Tan Tax formerly known as the "Botax" that was passed with the healthcare reform bill.","Please remove the 10% tan tax placed on tanning salons to pay for healthcare reform. This tax was removed from botox and plastic surgery and borders on being racist and sexist.","2012-11-13 14:27:46",3801,427,24573,25000,Closed
50a29f567043017416000016,"Affirm that the State of North Carolina is and will continue to be one of these United States of America.","We ask the President to affirm that the quiet strength of this great nation lies in a patient and powerful unity that transcends and transforms our differences and does not waiver in the face of impetuous and petulant indifference to the rule of law.

We pledge allegiance to the Flag of the United States of America, and to the Republic for which it stands, one Nation under God, indivisible, with liberty and justice for all. We do not support secession.

We the people of North Carolina will support and defend the Constitution and laws of the United States of America against all enemies, foreign and domestic.  We ask the President to recognize our commitment to the endurance of our extraordinary union.","2012-11-13 14:37:52",3806,2434,22566,25000,Closed
50a29fdc0aa04d6c01000003,"Stop using hundreds of millions of our tax dollars to fund planned parenthood. Where is our CHOICE? Defund them now!","Defund Planned Parenthood. Planned parenthood is killing innocent unborn human life through abortion and we are funding this against our wishes and values. We stand for the rights of the unborn. Stop using hundreds of millions of our tax dollars to fund planned parenthood. 

 " You shall not murder" Exodus 20:13, Matthew 5:21","2012-11-13 14:48:21",3811,9660,15340,25000,Closed
50a2a1277043013a42000002,"have the President to attend a Fark.com party. If scheduling does not permit, at least have a beer with Drew Curtis","Too many serious petitions on this site asking the President to work his butt off. We believe that he should have a chance to have a good time.","2012-11-13 14:37:14",3816,1186,23814,25000,Closed
50a2a2c5ee140f5413000016,"Grant refugee status for LGBTQIA people and cut foreign aid until repeal of "Kill the Gays" Bill in Uganda!","Rebecca Kadaga, speaker of the Ugandan parliament, promised to push the “Kill the Gays” Bill through Parliament by the end of December as a “Christmas Gift” to Christians in Uganda. President Obama, it is time you give your own gift to the gay, lesbian, bisexual, transgender, and all queer people of Uganda, and the world.

Please
-Expand the definition of refugee status to include sexual orientation and gender expression.
-Grant such asylum to the people of Uganda.
-Allow queer families to apply together and not discriminate against them based on their marital status.
-End foreign aid to the Ugandan government until the bill is repealed.

America needs to take action to protect LGBTQ people against persecution. We can not stand by and let this atrocity occur in Uganda or anywhere else.","2012-11-13 14:52:26",3821,4874,20126,25000,Closed
50a2a94500e579742d00000f,"Require Barack Obama To Allow The Public Examination Of His Birth Certificate Records & His College & University Records","We The People request the Obama Administration to require Barack H. Obama to authorize the public examination of his birth certificate records together his college and university records. We have all seen the document produced by The White House which has been declared suspect by Sheriff Joe Arpaio, but The People request that Barack Obama authorize the State of Hawaii to release all related information concerning his birth in the State. We also request that Barack Obama authorize Occidental College and Harvard University release all records they hold in connection with The President. The People will willingly pay a reasonable fee for each page or document copied and provided by either entity in accordance with their standard fee schedule.","2012-11-13 15:18:14",3826,11958,13042,25000,Closed
50a2aa0c6889384c14000001,"Address Legal Kidnapping across the United States By The Over Powered CPS","Families are being abused by State CPS and Family Courts through out the United States of America, this is a major issue that needs to be addressed, Families have had their civil rights violated through family court proceedings and the fact that all due process and constitutional rights are violated and manipulated by family court judges, District Attorneys, and Commissioners of /social services departments as well as CPS workers, and court appointed attorneys that are not working for the clients but have helped incriminate parents  Also of extreme interest, is obtaining names/phone/location of CPS workers who are falsifying or have falsified documents in court and who have lied in a court setting. The People of the United States of America demand a full investigation","2012-11-13 15:20:34",3831,602,24398,25000,Closed
50a2b0830aa04da241000006,"Implement a Policy for Declassifying Discoveries by NSA Mathematicians","The NSA is the largest employer of mathematicians in the United States. Currently, the discoveries of those mathematicians in their official areas of research, being deemed potentially critical to national security, are indiscriminately classified for an indefinite period, with limited circumstances for declassification.

It is requested the White House press the NSA for an expiration policy for the classification status of non-applied discoveries and instituting an expiration for gag order patents in the interest of furthering American academia and industry advancement and in the interest of crediting the discoveries of our nation's talented NSA employees.","2012-11-13 16:21:08",3836,2199,22801,25000,Closed
